{
  "$schema": "https://json-schema.org/draft/2020-12/schema",
  "$id": "https://models.geonicdb.com/schema/disaster/RoadClosure/v2.0.0.json",
  "title": "RoadClosure",
  "description": "One road closure: road name, closed section as a LineString, and status.",
  "x-version": "2.0.0",
  "x-license-url": "https://models.geonicdb.com/LICENSE-CONTENT",
  "x-model-tags": "GeonicDB, disaster-response, Japan",
  "x-derived-from": "https://github.com/geolonia/geonicdb-datamodels",
  "type": "object",
  "properties": {
    "id": {
      "type": "string",
      "format": "uri",
      "description": "Entity id (URN)"
    },
    "type": {
      "type": "string",
      "const": "RoadClosure",
      "description": "Entity type"
    },
    "project": {
      "type": "string",
      "format": "uri",
      "description": "The disaster event (DisasterEvent) this entity belongs to",
      "x-ngsi": {
        "type": "Relationship",
        "target": "https://models.geonicdb.com/ns/task/Project"
      },
      "x-iri": "https://models.geonicdb.com/ns/task/project",
      "x-geonicdb": {
        "indexed": true
      }
    },
    "roadName": {
      "description": "Road name",
      "type": "string",
      "x-ngsi": {
        "type": "Property"
      },
      "x-iri": "https://models.geonicdb.com/ns/disaster/roadName"
    },
    "address": {
      "$ref": "https://models.geonicdb.com/schema/common/JapaneseAddress/v1.0.0.json",
      "description": "Address of the location, as a JapaneseAddress value (common subject)",
      "x-ngsi": {
        "type": "Property",
        "model": "https://models.geonicdb.com/ns/common/JapaneseAddress"
      },
      "x-iri": "https://schema.org/address"
    },
    "area": {
      "description": "Closed section",
      "type": "object",
      "properties": {
        "type": {
          "const": "LineString"
        },
        "coordinates": {
          "type": "array",
          "minItems": 2,
          "items": {
            "type": "array",
            "minItems": 2,
            "maxItems": 3,
            "items": {
              "type": "number"
            }
          }
        }
      },
      "required": [
        "type",
        "coordinates"
      ],
      "x-ngsi": {
        "type": "GeoProperty",
        "model": "https://purl.org/geojson/vocab#LineString"
      },
      "x-iri": "https://models.geonicdb.com/ns/disaster/area"
    },
    "closureStatus": {
      "description": "Closure status. `status` is protected in the core context, hence closureStatus",
      "type": "string",
      "enum": [
        "依頼中",
        "通行止め中",
        "解除済み"
      ],
      "x-ngsi": {
        "type": "Property"
      },
      "x-iri": "https://models.geonicdb.com/ns/disaster/closureStatus"
    },
    "description": {
      "type": "string",
      "description": "Free-text memo",
      "x-ngsi": {
        "type": "Property"
      },
      "x-iri": "https://uri.etsi.org/ngsi-ld/v1/ngsi-ld-core-context-v1.8.jsonld#description"
    }
  },
  "required": [
    "id",
    "type",
    "project"
  ],
  "additionalProperties": false
}
