{
  "id": "urn:ngsi-ld:RoadClosure:2026-typhoon-10-001",
  "type": "RoadClosure",
  "project": "urn:ngsi-ld:DisasterEvent:2026-typhoon-10",
  "roadName": "県道14号",
  "address": {
    "addressRegion": "香川県",
    "addressLocality": "高松市",
    "machiaza": "西宝町",
    "banchi": "2",
    "go": "3",
    "jisMunicipalityCode": "37201",
    "addressText": "香川県高松市西宝町2-3"
  },
  "area": {
    "type": "LineString",
    "coordinates": [
      [
        134.04,
        34.34
      ],
      [
        134.05,
        34.35
      ]
    ]
  },
  "closureStatus": "通行止め中",
  "description": "冠水のため通行止め"
}
